{
  "$schema": "../schemas/course.schema.json",
  "schema_version": "gap-course-v1",
  "generator_version": "0.1.0",
  "start_position": [0, 4, 0],
  "heading_degrees": 0,
  "platform_width": 12,
  "platform_length": 14,
  "platform_height": 1,
  "gap_min": 4,
  "gap_max": 8,
  "finish_depth": 4,
  "kill_plane_y": -25
}
